{
  "spec_version": "1.0.1",
  "schema_version": "2.0",
  "source_kind": "git_checkout",
  "source_commit": "aaaaaaaaaaaaaaaaaaaaaaaaaaaaaaaaaaaaaaaa",
  "source_dirty": true,
  "package_sha256": null,
  "base": {
    "spec": "ai-native-cli-spec",
    "tag": "v1.6.3",
    "commit": "d6733433e2a9b93a4e6fb169c6927f6604ec89c7"
  },
  "files": [
    {
      "path": ".agent/driver/schemas/receipt.schema.json",
      "source_path": "schemas/receipt.schema.json",
      "sha256": "cccccccccccccccccccccccccccccccccccccccccccccccccccccccccccccccc"
    },
    {
      "path": ".agent/driver/contract/driver-contract.json",
      "source_path": "contract/driver-contract.json",
      "sha256": "dddddddddddddddddddddddddddddddddddddddddddddddddddddddddddddddd"
    }
  ],
  "limitations": [
    "Copied from a working tree with uncommitted changes; the commit alone does not reproduce these bytes."
  ]
}
